{
  "schema_version": "1.0",
  "search_id": "DEMO-SEARCH-INTEGRATION-001",
  "profile_version": 1,
  "budget": {
    "currency": "AUD",
    "period": "week",
    "scope": "per_person",
    "includes_bills": true,
    "preferred": 450,
    "maximum": 550,
    "hard_limit": true
  },
  "occupants": 1,
  "rental_mode": "private_room",
  "destination_id": "demo-usyd",
  "arrival_time": "09:00",
  "timezone": "Australia/Sydney",
  "commute": {
    "modes": [
      "public_transport",
      "walk"
    ],
    "preferred_minutes": 25,
    "maximum_minutes": 40,
    "hard_limit": true
  },
  "move_in_window": {
    "from": "2027-02-01",
    "to": "2027-02-07"
  },
  "lease_months": 12,
  "hard_requirements": [
    "private_bedroom"
  ],
  "soft_preferences": {
    "furnished": 0.6,
    "private_bathroom": 0.4
  },
  "weights": {
    "commute": 0.35,
    "cost": 0.3,
    "housing": 0.2,
    "amenities": 0.15
  }
}
